{
  "$schema": "./schema.json",
  "profileId": "keychron-q6-pro-ansi-knob",
  "version": 2,
  "layoutHash": "de355358987dddc4f73a610892192e63e36facecc2417aa4b4e0ac4a40a63346",
  "name": "Keychron Q6 Pro ANSI Knob",
  "transports": {
    "usb": {
      "vendorId": 13364,
      "productIds": [
        1632
      ],
      "usagePage": 65376,
      "usage": 97,
      "mode": "full"
    },
    "bluetooth": {
      "vendorId": 13364,
      "productIds": [
        1632
      ],
      "usagePage": 1,
      "usage": 6,
      "mode": "degraded"
    }
  },
  "matrix": {
    "rows": 6,
    "columns": 21
  },
  "ledCount": 108,
  "controls": [
    {
      "id": "r0c0",
      "kind": "key",
      "label": "Esc",
      "code": "KC_ESC",
      "matrix": {
        "row": 0,
        "column": 0
      },
      "ledIndex": 0,
      "bindable": true,
      "unit": {
        "x": 0,
        "y": 0,
        "width": 1,
        "height": 1
      },
      "frame": {
        "x": 0,
        "y": 0,
        "width": 0.044444,
        "height": 0.16
      }
    },
    {
      "id": "r0c1",
      "kind": "key",
      "label": "F1",
      "code": "KC_BRID",
      "matrix": {
        "row": 0,
        "column": 1
      },
      "ledIndex": 1,
      "bindable": true,
      "unit": {
        "x": 1.25,
        "y": 0,
        "width": 1,
        "height": 1
      },
      "frame": {
        "x": 0.055556,
        "y": 0,
        "width": 0.044444,
        "height": 0.16
      }
    },
    {
      "id": "r0c2",
      "kind": "key",
      "label": "F2",
      "code": "KC_BRIU",
      "matrix": {
        "row": 0,
        "column": 2
      },
      "ledIndex": 2,
      "bindable": true,
      "unit": {
        "x": 2.25,
        "y": 0,
        "width": 1,
        "height": 1
      },
      "frame": {
        "x": 0.1,
        "y": 0,
        "width": 0.044444,
        "height": 0.16
      }
    },
    {
      "id": "r0c3",
      "kind": "key",
      "label": "F3",
      "code": "KC_MCTL",
      "matrix": {
        "row": 0,
        "column": 3
      },
      "ledIndex": 3,
      "bindable": true,
      "unit": {
        "x": 3.25,
        "y": 0,
        "width": 1,
        "height": 1
      },
      "frame": {
        "x": 0.144444,
        "y": 0,
        "width": 0.044444,
        "height": 0.16
      }
    },
    {
      "id": "r0c4",
      "kind": "key",
      "label": "F4",
      "code": "KC_LPAD",
      "matrix": {
        "row": 0,
        "column": 4
      },
      "ledIndex": 4,
      "bindable": true,
      "unit": {
        "x": 4.25,
        "y": 0,
        "width": 1,
        "height": 1
      },
      "frame": {
        "x": 0.188889,
        "y": 0,
        "width": 0.044444,
        "height": 0.16
      }
    },
    {
      "id": "r0c5",
      "kind": "key",
      "label": "F5",
      "code": "RGB_VAD",
      "matrix": {
        "row": 0,
        "column": 5
      },
      "ledIndex": 5,
      "bindable": true,
      "unit": {
        "x": 5.5,
        "y": 0,
        "width": 1,
        "height": 1
      },
      "frame": {
        "x": 0.244444,
        "y": 0,
        "width": 0.044444,
        "height": 0.16
      }
    },
    {
      "id": "r0c6",
      "kind": "key",
      "label": "F6",
      "code": "RGB_VAI",
      "matrix": {
        "row": 0,
        "column": 6
      },
      "ledIndex": 6,
      "bindable": true,
      "unit": {
        "x": 6.5,
        "y": 0,
        "width": 1,
        "height": 1
      },
      "frame": {
        "x": 0.288889,
        "y": 0,
        "width": 0.044444,
        "height": 0.16
      }
    },
    {
      "id": "r0c7",
      "kind": "key",
      "label": "F7",
      "code": "KC_MPRV",
      "matrix": {
        "row": 0,
        "column": 7
      },
      "ledIndex": 7,
      "bindable": true,
      "unit": {
        "x": 7.5,
        "y": 0,
        "width": 1,
        "height": 1
      },
      "frame": {
        "x": 0.333333,
        "y": 0,
        "width": 0.044444,
        "height": 0.16
      }
    },
    {
      "id": "r0c8",
      "kind": "key",
      "label": "F8",
      "code": "KC_MPLY",
      "matrix": {
        "row": 0,
        "column": 8
      },
      "ledIndex": 8,
      "bindable": true,
      "unit": {
        "x": 8.5,
        "y": 0,
        "width": 1,
        "height": 1
      },
      "frame": {
        "x": 0.377778,
        "y": 0,
        "width": 0.044444,
        "height": 0.16
      }
    },
    {
      "id": "r0c9",
      "kind": "key",
      "label": "F9",
      "code": "KC_MNXT",
      "matrix": {
        "row": 0,
        "column": 9
      },
      "ledIndex": 9,
      "bindable": true,
      "unit": {
        "x": 9.75,
        "y": 0,
        "width": 1,
        "height": 1
      },
      "frame": {
        "x": 0.433333,
        "y": 0,
        "width": 0.044444,
        "height": 0.16
      }
    },
    {
      "id": "r0c10",
      "kind": "key",
      "label": "Mute",
      "code": "KC_MUTE",
      "matrix": {
        "row": 0,
        "column": 10
      },
      "ledIndex": 10,
      "bindable": true,
      "unit": {
        "x": 10.75,
        "y": 0,
        "width": 1,
        "height": 1
      },
      "frame": {
        "x": 0.477778,
        "y": 0,
        "width": 0.044444,
        "height": 0.16
      }
    },
    {
      "id": "r0c11",
      "kind": "key",
      "label": "F11",
      "code": "KC_VOLD",
      "matrix": {
        "row": 0,
        "column": 11
      },
      "ledIndex": 11,
      "bindable": true,
      "unit": {
        "x": 11.75,
        "y": 0,
        "width": 1,
        "height": 1
      },
      "frame": {
        "x": 0.522222,
        "y": 0,
        "width": 0.044444,
        "height": 0.16
      }
    },
    {
      "id": "r0c12",
      "kind": "key",
      "label": "F12",
      "code": "KC_VOLU",
      "matrix": {
        "row": 0,
        "column": 12
      },
      "ledIndex": 12,
      "bindable": true,
      "unit": {
        "x": 12.75,
        "y": 0,
        "width": 1,
        "height": 1
      },
      "frame": {
        "x": 0.566667,
        "y": 0,
        "width": 0.044444,
        "height": 0.16
      }
    },
    {
      "id": "r0c13",
      "kind": "knobPress",
      "label": "Mute",
      "code": "KC_MUTE",
      "matrix": {
        "row": 0,
        "column": 13
      },
      "ledIndex": null,
      "bindable": true,
      "unit": {
        "x": 14,
        "y": 0,
        "width": 1,
        "height": 1
      },
      "frame": {
        "x": 0.622222,
        "y": 0,
        "width": 0.044444,
        "height": 0.16
      }
    },
    {
      "id": "r0c14",
      "kind": "key",
      "label": "Snapshot",
      "code": "KC_SNAP",
      "matrix": {
        "row": 0,
        "column": 14
      },
      "ledIndex": 13,
      "bindable": true,
      "unit": {
        "x": 15.25,
        "y": 0,
        "width": 1,
        "height": 1
      },
      "frame": {
        "x": 0.677778,
        "y": 0,
        "width": 0.044444,
        "height": 0.16
      }
    },
    {
      "id": "r0c15",
      "kind": "key",
      "label": "Siri",
      "code": "KC_SIRI",
      "matrix": {
        "row": 0,
        "column": 15
      },
      "ledIndex": 14,
      "bindable": true,
      "unit": {
        "x": 16.25,
        "y": 0,
        "width": 1,
        "height": 1
      },
      "frame": {
        "x": 0.722222,
        "y": 0,
        "width": 0.044444,
        "height": 0.16
      }
    },
    {
      "id": "r0c16",
      "kind": "key",
      "label": "Light",
      "code": "RGB_MOD",
      "matrix": {
        "row": 0,
        "column": 16
      },
      "ledIndex": 15,
      "bindable": true,
      "unit": {
        "x": 17.25,
        "y": 0,
        "width": 1,
        "height": 1
      },
      "frame": {
        "x": 0.766667,
        "y": 0,
        "width": 0.044444,
        "height": 0.16
      }
    },
    {
      "id": "r0c17",
      "kind": "key",
      "label": "F13",
      "code": "KC_F13",
      "matrix": {
        "row": 0,
        "column": 17
      },
      "ledIndex": 16,
      "bindable": true,
      "unit": {
        "x": 18.5,
        "y": 0,
        "width": 1,
        "height": 1
      },
      "frame": {
        "x": 0.822222,
        "y": 0,
        "width": 0.044444,
        "height": 0.16
      }
    },
    {
      "id": "r0c18",
      "kind": "key",
      "label": "F14",
      "code": "KC_F14",
      "matrix": {
        "row": 0,
        "column": 18
      },
      "ledIndex": 17,
      "bindable": true,
      "unit": {
        "x": 19.5,
        "y": 0,
        "width": 1,
        "height": 1
      },
      "frame": {
        "x": 0.866667,
        "y": 0,
        "width": 0.044444,
        "height": 0.16
      }
    },
    {
      "id": "r0c19",
      "kind": "key",
      "label": "F15",
      "code": "KC_F15",
      "matrix": {
        "row": 0,
        "column": 19
      },
      "ledIndex": 18,
      "bindable": true,
      "unit": {
        "x": 20.5,
        "y": 0,
        "width": 1,
        "height": 1
      },
      "frame": {
        "x": 0.911111,
        "y": 0,
        "width": 0.044444,
        "height": 0.16
      }
    },
    {
      "id": "r0c20",
      "kind": "key",
      "label": "F16",
      "code": "KC_F16",
      "matrix": {
        "row": 0,
        "column": 20
      },
      "ledIndex": 19,
      "bindable": true,
      "unit": {
        "x": 21.5,
        "y": 0,
        "width": 1,
        "height": 1
      },
      "frame": {
        "x": 0.955556,
        "y": 0,
        "width": 0.044444,
        "height": 0.16
      }
    },
    {
      "id": "r1c0",
      "kind": "key",
      "label": "`",
      "code": "KC_GRV",
      "matrix": {
        "row": 1,
        "column": 0
      },
      "ledIndex": 20,
      "bindable": true,
      "unit": {
        "x": 0,
        "y": 1.25,
        "width": 1,
        "height": 1
      },
      "frame": {
        "x": 0,
        "y": 0.2,
        "width": 0.044444,
        "height": 0.16
      }